{
  "width": 1920,
  "height": 1080,
  "fps": 30,
  "brand": "JAZZ CLI 0.9.0",
  "background": "#0E1220",
  "textColor": "#F3F1E9",
  "accent": "#7CC4FF",
  "voice": "pf_dora",
  "voiceLanguage": "pt-br",
  "music": true,
  "scenes": [
    {
      "kind": "title",
      "seconds": 4,
      "eyebrow": "JAZZ AUTOMATIONS",
      "title": "Roda onde ninguém roda.",
      "subtitle": "Um agente de código no terminal. Até num Pentium M de 2005.",
      "narration": "Jazz C L I. Nasceu pra rodar na máquina que todo mundo desistiu."
    },
    {
      "kind": "screen",
      "seconds": 6.9,
      "src": "capture/site-a.mp4",
      "sourceWidth": 1920,
      "sourceHeight": 1080,
      "keys": [
        {
          "frame": 0,
          "cx": 960,
          "cy": 540,
          "zoom": 1
        },
        {
          "frame": 78,
          "cx": 960,
          "cy": 540,
          "zoom": 1
        },
        {
          "frame": 140,
          "cx": 715,
          "cy": 340,
          "zoom": 1.6
        },
        {
          "frame": 206,
          "cx": 715,
          "cy": 340,
          "zoom": 1.6
        }
      ],
      "narration": "Um binário em Go, sem Node e sem dependência. Instala com um comando, sem sudo."
    },
    {
      "kind": "screen",
      "seconds": 7,
      "src": "capture/site-b.mp4",
      "sourceWidth": 1920,
      "sourceHeight": 1080,
      "keys": [
        {
          "frame": 0,
          "cx": 960,
          "cy": 540,
          "zoom": 1
        },
        {
          "frame": 45,
          "cx": 960,
          "cy": 540,
          "zoom": 1
        },
        {
          "frame": 85,
          "cx": 1255,
          "cy": 380,
          "zoom": 1.45
        },
        {
          "frame": 125,
          "cx": 1255,
          "cy": 380,
          "zoom": 1.45
        },
        {
          "frame": 150,
          "cx": 1290,
          "cy": 503,
          "zoom": 1.9
        },
        {
          "frame": 175,
          "cx": 1290,
          "cy": 503,
          "zoom": 1.9
        },
        {
          "frame": 195,
          "cx": 1190,
          "cy": 545,
          "zoom": 1.9
        },
        {
          "frame": 209,
          "cx": 1190,
          "cy": 545,
          "zoom": 1.9
        }
      ],
      "narration": "Ele lê, roda, edita e confere. Se o modelo é fraco, o harness cobra: sem teste depois da edição, não tá pronto."
    },
    {
      "kind": "screen",
      "seconds": 4.6,
      "src": "capture/site-c.mp4",
      "sourceWidth": 1920,
      "sourceHeight": 1080,
      "keys": [
        {
          "frame": 0,
          "cx": 960,
          "cy": 540,
          "zoom": 1
        },
        {
          "frame": 45,
          "cx": 960,
          "cy": 540,
          "zoom": 1
        },
        {
          "frame": 85,
          "cx": 1234,
          "cy": 390,
          "zoom": 1.4
        },
        {
          "frame": 110,
          "cx": 1234,
          "cy": 390,
          "zoom": 1.4
        },
        {
          "frame": 137,
          "cx": 1410,
          "cy": 510,
          "zoom": 1.9
        }
      ],
      "narration": "A régua é um Dell de 2005: Pentium M, dois giga de RAM, treze mega de binário. Se roda nele, roda em qualquer lugar."
    },
    {
      "kind": "character",
      "seconds": 3.5,
      "props": {
        "title": "Modelo grátis?",
        "subtitle": "Ele entrega mesmo assim."
      },
      "narration": "Modelo grátis? Entrega mesmo assim."
    },
    {
      "kind": "three",
      "seconds": 3.5,
      "title": "Offline. Determinístico.",
      "narration": "Sem rede, modo offline: atalhos determinísticos de verdade."
    },
    {
      "kind": "title",
      "seconds": 4.5,
      "eyebrow": "MIT · GO · LINUX/386 → ARM64",
      "title": "Jazz CLI.",
      "subtitle": "jazz-cli.jazzautomations.com.br",
      "closing": true,
      "narration": "Jazz C L I. Roda onde ninguém roda."
    }
  ]
}