{
  "width": 1920,
  "height": 1080,
  "fps": 30,
  "brand": "VIDEO FORGE / WOHACKERS",
  "background": "#101710",
  "textColor": "#F3F1E9",
  "accent": "#D7FF64",
  "voice": "pf_dora",
  "voiceLanguage": "pt-br",
  "music": true,
  "durationSeconds": 20,
  "scenes": [
    {
      "kind": "title",
      "seconds": 4,
      "eyebrow": "JAZZ AUTOMATIONS / VIDEO FORGE",
      "title": "Vídeo é código.",
      "subtitle": "As peças certas. Na hora certa.",
      "narration": "Vídeo é código. As peças certas fazem a diferença."
    },
    {
      "kind": "screen",
      "seconds": 5,
      "src": "screen.mp4",
      "sourceWidth": 1920,
      "sourceHeight": 1080,
      "keys": [
        {
          "frame": 0,
          "cx": 960,
          "cy": 540,
          "zoom": 1
        },
        {
          "frame": 30,
          "cx": 960,
          "cy": 540,
          "zoom": 1
        },
        {
          "frame": 57,
          "cx": 1270,
          "cy": 700,
          "zoom": 1.25
        },
        {
          "frame": 75,
          "cx": 1280,
          "cy": 690,
          "zoom": 1.5
        },
        {
          "frame": 115,
          "cx": 1280,
          "cy": 690,
          "zoom": 1.5
        },
        {
          "frame": 149,
          "cx": 960,
          "cy": 540,
          "zoom": 1
        }
      ],
      "masks": [
        {
          "x": 1550,
          "y": 32,
          "width": 300,
          "height": 60,
          "from": 0,
          "to": 150
        }
      ],
      "cursor": [
        {
          "frame": 0,
          "x": 1600,
          "y": 930
        },
        {
          "frame": 35,
          "x": 1313,
          "y": 747
        },
        {
          "frame": 57,
          "x": 1313,
          "y": 747,
          "click": true
        },
        {
          "frame": 149,
          "x": 1420,
          "y": 900
        }
      ],
      "narration": "Grave a tela, destaque o que importa e proteja seus dados."
    },
    {
      "kind": "character",
      "seconds": 3,
      "props": {
        "title": "Dê vida.",
        "subtitle": "Personagens também são código."
      },
      "narration": "Dê vida às suas ideias."
    },
    {
      "kind": "three",
      "seconds": 4,
      "title": "Geometria. Luz. Câmera.",
      "narration": "Geometria, luz e câmera. Tudo em código."
    },
    {
      "kind": "title",
      "seconds": 4,
      "eyebrow": "VIDEO FORGE / OPEN SOURCE",
      "title": "Código que vira vídeo.",
      "subtitle": "Pesquisa. Reuso. Direção. Render de verdade.",
      "closing": true,
      "narration": "Narração, legendas e som. Agora, faça o seu."
    }
  ]
}
